{
  "_sample_comment": "这是一个 sample，文件实质完成后删掉这行注释",
  "schema_version": "1.0.0",
  "template_id": "complete-derived-author-persona-template",
  "required_directories": [
    "derivation-profile",
    "derived-author-model/core-derived-author-model",
    "derived-author-model/genre-specific-writing-modes",
    "author-specific-writing-harness",
    "derived-author-memory",
    "derived-author-writing-work-items",
    "derived-author-evaluations",
    "derived-author-publications"
  ],
  "required_paths": [
    "README.md",
    "AGENTS.md",
    "derived-author-persona-manifest.json",
    "derived-author-lineage.json",
    "derivation-profile/inherited-source-author-traits.md",
    "derivation-profile/transformed-source-author-traits.md",
    "derivation-profile/rejected-source-author-traits.md",
    "derivation-profile/original-derived-author-traits.md",
    "derivation-profile/derivation-rationale-and-design-decisions.md",
    "derived-author-model/VERSION",
    "derived-author-model/derived-author-model-manifest.json",
    "derived-author-model/derived-author-model-loading-map.json",
    "derived-author-model/core-derived-author-model/derived-author-identity-and-public-role.md",
    "derived-author-model/core-derived-author-model/recurring-concerns-and-topic-boundaries.md",
    "derived-author-model/core-derived-author-model/worldview-values-and-central-tensions.md",
    "derived-author-model/core-derived-author-model/knowledge-boundaries-and-research-obligations.md",
    "derived-author-model/core-derived-author-model/reasoning-patterns-and-problem-framing.md",
    "derived-author-model/core-derived-author-model/emotional-register-and-narrative-distance.md",
    "derived-author-model/core-derived-author-model/voice-and-writing-style-fingerprint.md",
    "derived-author-model/core-derived-author-model/authorial-and-ethical-boundaries.md",
    "derived-author-model/core-derived-author-model/model-uncertainties-and-open-questions.md",
    "derived-author-model/genre-specific-writing-modes/README.md",
    "author-specific-writing-harness/derived-author-writing-overlays.md",
    "derived-author-memory/author-writing-memory.md",
    "derived-author-memory/editorial-review-memory.md",
    "derived-author-memory/knowledge-growth-log.md",
    "derived-author-memory/publication-history.jsonl",
    "derived-author-writing-work-items/README.md",
    "derived-author-writing-work-items/derived-author-work-item-index.jsonl",
    "derived-author-evaluations/README.md",
    "derived-author-publications/README.md",
    "derived-author-publications/derived-author-publication-index.jsonl"
  ],
  "markdown_files": [
    {"path": "README.md", "title": "{{display_name}}", "purpose": "Human-readable derived-author overview."},
    {"path": "AGENTS.md", "title": "{{display_name}} Instructions for Agents", "purpose": "Local loading, mutation, and isolation rules."},
    {"path": "derivation-profile/inherited-source-author-traits.md", "title": "Inherited Source-Author Traits", "purpose": "Traits intentionally inherited from the declared source model."},
    {"path": "derivation-profile/transformed-source-author-traits.md", "title": "Transformed Source-Author Traits", "purpose": "Inherited traits deliberately changed for the independent persona."},
    {"path": "derivation-profile/rejected-source-author-traits.md", "title": "Rejected Source-Author Traits", "purpose": "Source traits, biography, authority, and language that must not transfer."},
    {"path": "derivation-profile/original-derived-author-traits.md", "title": "Original Derived-Author Traits", "purpose": "Independent identity, concerns, knowledge, and formal commitments."},
    {"path": "derivation-profile/derivation-rationale-and-design-decisions.md", "title": "Derivation Rationale and Design Decisions", "purpose": "Reasons for inheritance, transformation, rejection, and original additions."},
    {"path": "derived-author-model/core-derived-author-model/derived-author-identity-and-public-role.md", "title": "Derived-Author Identity and Public Role", "purpose": "The persona's independent public identity."},
    {"path": "derived-author-model/core-derived-author-model/recurring-concerns-and-topic-boundaries.md", "title": "Recurring Concerns and Topic Boundaries", "purpose": "Stable subjects and research-before-writing boundaries."},
    {"path": "derived-author-model/core-derived-author-model/worldview-values-and-central-tensions.md", "title": "Worldview, Values, and Central Tensions", "purpose": "Independent value structure and unresolved tensions."},
    {"path": "derived-author-model/core-derived-author-model/knowledge-boundaries-and-research-obligations.md", "title": "Knowledge Boundaries and Research Obligations", "purpose": "Demonstrated knowledge and mandatory research boundaries."},
    {"path": "derived-author-model/core-derived-author-model/reasoning-patterns-and-problem-framing.md", "title": "Reasoning Patterns and Problem Framing", "purpose": "How the persona notices, frames, contextualizes, and judges problems."},
    {"path": "derived-author-model/core-derived-author-model/emotional-register-and-narrative-distance.md", "title": "Emotional Register and Narrative Distance", "purpose": "Permitted emotion, first-person distance, restraint, and humor."},
    {"path": "derived-author-model/core-derived-author-model/voice-and-writing-style-fingerprint.md", "title": "Voice and Writing Style Fingerprint", "purpose": "Syntax, rhythm, paragraphs, rhetoric, endings, and anti-overfitting rules."},
    {"path": "derived-author-model/core-derived-author-model/authorial-and-ethical-boundaries.md", "title": "Authorial and Ethical Boundaries", "purpose": "Identity, invention, factuality, and source-leakage prohibitions."},
    {"path": "derived-author-model/core-derived-author-model/model-uncertainties-and-open-questions.md", "title": "Model Uncertainties and Open Questions", "purpose": "Unstable traits that must not silently become permanent identity."},
    {"path": "derived-author-model/genre-specific-writing-modes/README.md", "title": "Genre-Specific Writing Modes", "purpose": "Index and rules for persona-specific genre overlays."},
    {"path": "author-specific-writing-harness/derived-author-writing-overlays.md", "title": "Derived-Author Writing Harness Overlays", "purpose": "Persona-specific loading and distinction rules layered over the shared harness."},
    {"path": "derived-author-memory/author-writing-memory.md", "title": "Derived-Author Writing Memory", "purpose": "Approved writing history and deliberate persona development."},
    {"path": "derived-author-memory/editorial-review-memory.md", "title": "Editorial Review Memory", "purpose": "Repeated editorial findings and accepted corrections."},
    {"path": "derived-author-memory/knowledge-growth-log.md", "title": "Knowledge Growth Log", "purpose": "Reviewed knowledge additions independent from personality changes."},
    {"path": "derived-author-writing-work-items/README.md", "title": "Derived-Author Writing Work-Item View", "purpose": "Generated index view; canonical work items remain at repository root."},
    {"path": "derived-author-evaluations/README.md", "title": "Derived-Author Evaluations", "purpose": "Persona-specific evaluation scope and reports."},
    {"path": "derived-author-publications/README.md", "title": "Derived-Author Publication View", "purpose": "Generated index view; canonical publications remain at repository root."}
  ],
  "default_genre_modes": [
    {"path": "derived-author-model/genre-specific-writing-modes/essay-writing-mode.md", "title": "Essay Writing Mode"},
    {"path": "derived-author-model/genre-specific-writing-modes/short-commentary-writing-mode.md", "title": "Short Commentary Writing Mode"},
    {"path": "derived-author-model/genre-specific-writing-modes/diary-and-life-writing-mode.md", "title": "Diary and Life Writing Mode"}
  ]
}
